{
 "format": "wise.preparation_catalogue.v1",
 "title": "Invented service-desk collection",
 "sources": [
  {"id": "note", "path": "README.txt", "kind": "text", "role": "documentation", "alias": {"classification": "original"},
   "provenance": {"origin": "Written by tools/make_catalogue_fixture.py", "licence": "Invented for WISE; the repository licence", "obtained": "2026-10-20"}},
  {"id": "tickets", "path": "desk/tickets.csv", "kind": "csv", "role": "event_log", "alias": {"classification": "original"},
   "provenance": {"origin": "Written by tools/make_catalogue_fixture.py: forty invented tickets", "licence": "Invented for WISE; the repository licence", "obtained": "2026-10-20"}},
  {"id": "teams", "path": "desk/teams.csv", "kind": "csv", "role": "static_master_data", "alias": {"classification": "original"},
   "snapshot": {"as_of": "2026-10-01", "meaning": "the team table as it stood when exported; not a history of team names"},
   "provenance": {"origin": "Written by tools/make_catalogue_fixture.py", "licence": "Invented for WISE; the repository licence", "obtained": "2026-10-20"}},
  {"id": "exports", "path": "desk/exports.zip", "kind": "zip_archive", "role": "archive", "alias": {"classification": "original"},
   "provenance": {"origin": "Written by tools/make_catalogue_fixture.py: an archive as it was handed over", "licence": "Invented for WISE; the repository licence", "obtained": "2026-10-20"},
   "members": [
    {"id": "tickets-copy", "name": "tickets-copy.csv", "kind": "csv", "role": "event_log", "alias": {"classification": "byte_identical_copy", "of": "tickets"}},
    {"id": "tickets-september", "name": "tickets-2026-09.csv", "kind": "csv", "role": "event_log",
     "alias": {"classification": "subset_of", "of": "tickets", "selection": "the records dated in September 2026, as exported; histories crossing into October are cropped"}},
    {"id": "earlier-scores", "name": "scores/earlier-scores.json", "kind": "json", "role": "earlier_analysis_state", "alias": {"classification": "derived_from", "of": "tickets"}}
   ]},
  {"id": "visits", "path": "service/visits.xes", "kind": "xes", "role": "event_log", "alias": {"classification": "original"},
   "provenance": {"origin": "Written by tools/make_catalogue_fixture.py: eight invented service visits", "licence": "Invented for WISE; the repository licence", "obtained": "2026-10-20"}},
  {"id": "orders", "path": "orders/orders.ocel.json", "kind": "ocel2_json", "role": "object_centric_event_log", "alias": {"classification": "original"},
   "provenance": {"origin": "Written by tools/make_catalogue_fixture.py: invented orders, items and packages", "licence": "Invented for WISE; the repository licence", "obtained": "2026-10-20"}},
  {"id": "cache", "path": "cache/population.cache", "kind": "binary", "role": "cache", "alias": {"classification": "derived_from", "of": "tickets"},
   "provenance": {"origin": "Written by tools/make_catalogue_fixture.py", "licence": "Invented for WISE; the repository licence", "obtained": "2026-10-20"}},
  {"id": "old-workspace", "path": "old-workspace", "kind": "directory", "role": "earlier_workspace", "alias": {"classification": "derived_from", "of": "tickets"},
   "provenance": {"origin": "Written by tools/make_catalogue_fixture.py: an earlier workspace kept as it was", "licence": "Invented for WISE; the repository licence", "obtained": "2026-10-20"}}
 ],
 "views": [
  {"id": "tickets-by-ticket", "source": "tickets", "conversion": {"kind": "csv_as_is"},
   "joins": [{"master": "teams", "view_key": "Team", "master_key": "Team", "columns": ["Team name", "Region"]}],
   "case_grain": "one service ticket",
   "dialect": {"encoding": "utf-8", "delimiter": ",", "quotechar": "\"", "header": "first_record"},
   "mapping": {"case": "Ticket", "activity": "Status", "time": "At", "sequence": null,
               "context": ["Team", "Channel", "teams:Team name", "teams:Region", "join:teams"]},
   "context_origin": {"Team": "event_attribute", "Channel": "event_attribute", "teams:Team name": "static_snapshot_join",
                      "teams:Region": "static_snapshot_join", "join:teams": "join_status"},
   "time": {"format": "iso8601", "clock": "offset_in_values", "snapshot_cutoff": "2026-10-31T00:00:00Z"},
   "lifecycle": {"reading": "not_recorded"},
   "source_order": "file_record_order",
   "rows": "tolerant",
   "observation_horizon": {"start": "2026-09-01T00:00:00Z", "end": "2026-10-31T00:00:00Z",
                           "basis": "the export covers tickets opened from September; the snapshot was taken at the end of October"},
   "pilot": {"case_count": 6}},
  {"id": "september-export", "source": "tickets-september", "conversion": {"kind": "csv_as_is"},
   "case_grain": "one service ticket, as far as the September export shows it",
   "dialect": {"encoding": "utf-8", "delimiter": ",", "quotechar": "\"", "header": "first_record"},
   "mapping": {"case": "Ticket", "activity": "Status", "time": "At", "sequence": null, "context": ["Team", "Channel"]},
   "context_origin": {"Team": "event_attribute", "Channel": "event_attribute"},
   "time": {"format": "iso8601", "clock": "offset_in_values", "snapshot_cutoff": "2026-10-01T00:00:00Z"},
   "lifecycle": {"reading": "not_recorded"},
   "source_order": "file_record_order",
   "rows": "tolerant",
   "observation_horizon": {"start": "2026-09-01T00:00:00Z", "end": "2026-10-01T00:00:00Z", "basis": "the export's own date range"},
   "pilot": {"case_count": 4}},
  {"id": "visits-by-case", "source": "visits", "conversion": {"kind": "xes_to_csv"},
   "case_grain": "one service visit (XES trace)",
   "dialect": {"encoding": "utf-8", "delimiter": ",", "quotechar": "\"", "header": "first_record"},
   "mapping": {"case": "trace:concept:name", "activity": "event:concept:name", "time": "event:time:timestamp", "sequence": null,
               "context": ["event:lifecycle:transition", "event:org:resource", "event:cost", "trace:channel", "trace:priority", "xes:trace_position", "xes:event_position"]},
   "context_origin": {"event:lifecycle:transition": "xes_lifecycle", "event:org:resource": "event_attribute", "event:cost": "event_attribute",
                      "trace:channel": "case_attribute_repeated", "trace:priority": "case_attribute_repeated",
                      "xes:trace_position": "source_position", "xes:event_position": "source_position"},
   "time": {"format": "iso8601", "clock": "offset_in_values", "snapshot_cutoff": "2026-09-01T00:00:00Z"},
   "lifecycle": {"reading": "transition_as_context", "pairing": "none"},
   "source_order": "xes_document_order",
   "rows": "tolerant",
   "observation_horizon": {"start": "2026-08-01T00:00:00Z", "end": "2026-09-01T00:00:00Z", "basis": "the visits of August 2026"},
   "pilot": {"case_count": 4}},
  {"id": "orders-by-order", "source": "orders", "conversion": {"kind": "ocel_object_type", "object_type": "order"},
   "case_grain": "one order (OCEL object of type order)",
   "dialect": {"encoding": "utf-8", "delimiter": ",", "quotechar": "\"", "header": "first_record"},
   "mapping": {"case": "object:id", "activity": "event:type", "time": "event:time", "sequence": null,
               "context": ["event:id", "e2o:qualifier", "event:carrier", "event:channel"]},
   "context_origin": {"event:id": "ocel_event_identity", "e2o:qualifier": "ocel_qualifier", "event:carrier": "event_attribute", "event:channel": "event_attribute"},
   "time": {"format": "iso8601", "clock": "offset_in_values", "snapshot_cutoff": "2026-08-01T00:00:00Z"},
   "lifecycle": {"reading": "not_recorded"},
   "source_order": "ocel_event_order",
   "rows": "tolerant",
   "observation_horizon": {"start": "2026-07-01T00:00:00Z", "end": "2026-08-01T00:00:00Z", "basis": "the orders of July 2026"},
   "pilot": {"case_count": 3}},
  {"id": "orders-by-item", "source": "orders", "conversion": {"kind": "ocel_object_type", "object_type": "item"},
   "case_grain": "one item (OCEL object of type item)",
   "dialect": {"encoding": "utf-8", "delimiter": ",", "quotechar": "\"", "header": "first_record"},
   "mapping": {"case": "object:id", "activity": "event:type", "time": "event:time", "sequence": null,
               "context": ["event:id", "e2o:qualifier", "event:picker", "event:channel"]},
   "context_origin": {"event:id": "ocel_event_identity", "e2o:qualifier": "ocel_qualifier", "event:picker": "event_attribute", "event:channel": "event_attribute"},
   "time": {"format": "iso8601", "clock": "offset_in_values", "snapshot_cutoff": "2026-08-01T00:00:00Z"},
   "lifecycle": {"reading": "not_recorded"},
   "source_order": "ocel_event_order",
   "rows": "tolerant",
   "observation_horizon": {"start": "2026-07-01T00:00:00Z", "end": "2026-08-01T00:00:00Z", "basis": "the orders of July 2026"},
   "pilot": {"case_count": 3}}
 ]
}
